{
  "authors": [
    {
      "family": "Fixture Maintainers"
    }
  ],
  "doc_key": "Fixture2000",
  "foundations": [],
  "language": "en",
  "schema_version": 1,
  "structure": [
    {
      "chapter": "1",
      "pages": {
        "first": 1,
        "last": 3
      },
      "sections": [
        "1.1"
      ],
      "title": "Toy complexes"
    }
  ],
  "title": "Toy chain complexes",
  "type": "synthetic",
  "year": 2000
}
